<?xml version="1.0" encoding="UTF-8"?>
<!DOCTYPE libreria[ 
 <!ELEMENT libreria (libro+)>
    <!ELEMENT libro (autor, titulo, editorial)>
    <!ELEMENT autor (#PCDATA)>
<!ELEMENT titulo (#PCDATA)>
<!ELEMENT editorial (#PCDATA)>
]>

<libreria>
<libro>
    <autor>Kentaro Miura</autor>
    <titulo> Bersertk</titulo> 
    <editorial> Panini </editorial>
</libro>
<libro>
    <autor>Kentaro Miura</autor>
    <titulo> JAPAN </titulo> 
    <editorial> Panini </editorial>
</libro>
</libreria>
